{
  "trace_version": "1.0.0",
  "input_sha256": "030542ed2d7d1d32c5d907d92120b476526fdb4912602786a3979344b0bff240",
  "rules_sha256": "5d365b3d4714f98eedfa8002644440aa095536b14d7769f32f8ef6d8f3df2eec",
  "dataset_partition_sha256": {
    "architecture_patterns.jsonl": "163677756cd30a08bbd5b0952915e8c981fd3aefc628fc8a9f524c679d7e2b39",
    "engineering_practices.jsonl": "6b1db6ac1f51cdb9b57764aca11881a9c1c7bb0ff36a7773f802488fb2339f66",
    "prompt_patterns.jsonl": "db5406b61cbb38f7d857065dafd9e287cfd32d4215ea2e53de103731dd8648ab",
    "reference_projects.jsonl": "0fd1c4621a16136fb5750da78f7ac7d32490d3655c2bb3827350459530889171",
    "relationships.jsonl": "05e8b75a515c2a586ffd798af8162a0effa200bc47e9e5bc292a23d0b6cbaec6",
    "roadmap_patterns.jsonl": "ffc58f804d848f25b626fa6240ff40c375d863969ebf449b06d703fe43dd8a41",
    "sdlc_stages.jsonl": "614662541ad76977a4a305fd500e70bce5973680d2941b30869c7f3f27fe29d5",
    "software_types.jsonl": "5a59f96ddfc493d67867d46279ff27cb6626cd7ee27f3dbc5772dfeb149559ec",
    "sources.jsonl": "9546a38f0b63fad87af49af995b1cbfa1393549e95d9236ea941d07d41a7b9b1",
    "verification_gates.jsonl": "c6bca575a05382f66fb53d062c48c51a5b2c4cfb93bd8d53b9da8b0eb15bac5a"
  },
  "descriptive_text_effect": "ignored_non_authoritative_text_not_copied",
  "rule_precedence": [
    "R-INPUT-001",
    "R-CATEGORY-001",
    "R-EXCLUSION-001",
    "R-AUTHORITY-001",
    "R-EVIDENCE-001",
    "R-STANDARD-001",
    "R-AGENT-001",
    "R-API-001",
    "R-CLI-001",
    "R-API-AUTH-001",
    "R-AGENT-002",
    "R-API-002",
    "R-CLI-002",
    "R-AGENT-003",
    "R-API-003",
    "R-API-004",
    "R-BASE-001",
    "R-RELEASE-001",
    "R-TYPE-BASE-001",
    "R-ARCH-001",
    "R-PRACTICE-001",
    "R-PRACTICE-002",
    "R-ROADMAP-001",
    "R-PROMPT-001",
    "R-EXAMPLE-001",
    "R-SCOPE-001"
  ],
  "selected_record_trace": [
    {
      "record_id": "arch.agent_tool_boundary",
      "rule_id": "R-AGENT-001",
      "predicate_matches": [
        {
          "fact_id": "reads_untrusted_external_content",
          "state": "true"
        },
        {
          "fact_id": "has_read_access",
          "state": "true"
        },
        {
          "fact_id": "has_bounded_write_tool",
          "state": "true"
        },
        {
          "fact_id": "can_cause_side_effects",
          "state": "true"
        },
        {
          "fact_id": "high_impact_action_possible",
          "state": "true"
        },
        {
          "fact_id": "approval_required_for_high_impact",
          "state": "true"
        },
        {
          "fact_id": "approver_available",
          "state": "false"
        },
        {
          "fact_id": "vector_database_requested",
          "state": "false"
        },
        {
          "fact_id": "multi_agent_autonomy_requested",
          "state": "false"
        },
        {
          "fact_id": "production_deployment_requested",
          "state": "false"
        },
        {
          "fact_id": "release_plan_required",
          "state": "false"
        }
      ],
      "scope_conditions": {
        "software_type_id": "software_type.ai_agents",
        "applicable_software_types": [
          "software_type.ai_agents",
          "software_type.developer_tools",
          "software_type.security_products"
        ]
      },
      "evidence_paths": [
        {
          "software_type_id": "software_type.ai_agents",
          "applicability_relationship_id": "edge.0012",
          "record_id": "arch.agent_tool_boundary",
          "sources": [
            {
              "source_id": "source.agents.policy",
              "claim_locator": "Private vulnerability reporting; scope; trust boundaries and security review",
              "source_type": "Pinned security policy",
              "source_claims_supported": "Private vulnerability reporting route and stated risk scope, including agent tools/MCP, sessions, tracing, dependencies, CI and publishing.",
              "source_limitations": "A policy does not prove controls are effective or vulnerabilities absent.",
              "relationship_id": "edge.0308",
              "evidence_classification": "observed_implementation"
            },
            {
              "source_id": "source.agents.instructions",
              "claim_locator": "Security checklist; CI permissions; publishing; evidence and handoff",
              "source_type": "Pinned agent/contributor instructions",
              "source_claims_supported": "Repository agent instructions include explicit security checklist and evidence expectations.",
              "source_limitations": "Instructions are written policy, not proof every workflow follows them.",
              "relationship_id": "edge.0309",
              "evidence_classification": "observed_implementation"
            },
            {
              "source_id": "source.owasp.tm.cheatsheet",
              "claim_locator": "Overview; system modeling; threat identification; mitigation; review and validation",
              "source_type": "Security guidance",
              "source_claims_supported": "Models system boundaries, data flows, stores, processes, external entities, threats and mitigations; no one universally accepted process.",
              "source_limitations": "Adaptable guidance; not a compliance standard.",
              "relationship_id": "edge.0310",
              "evidence_classification": "documented_guidance"
            },
            {
              "source_id": "source.openai.prompt_injection",
              "claim_locator": "Source-to-sink risk; Safe Url; sandboxed applications; confirmation for sensitive actions/transmissions",
              "source_type": "Official security engineering article",
              "source_claims_supported": "Describes prompt injection via untrusted content and recommends constraining actions, sandboxing/limits, and user confirmation or blocking for consequential actions and sensitive transmissions.",
              "source_limitations": "First-party security article, not independent benchmark; apply to the actual tool/data threat model.",
              "relationship_id": "edge.0387",
              "evidence_classification": "documented_guidance"
            },
            {
              "source_id": "source.nist.ssdf.v1_1",
              "claim_locator": "Sections 2-3; PO/PS/PW/RV practice headings, especially PW.1, PW.5, PW.7-PW.8 and RV.1-RV.3",
              "source_type": "Federal guidance publication",
              "source_claims_supported": "SSDF is recommended high-level guidance integrable into SDLCs; covers security requirements/risk modeling, code protection, secure coding/review/testing, release integrity and vulnerability response.",
              "source_limitations": "Guidance, not universal mandate unless adopted by policy, contract or regulation. Does not define universal stage gates.",
              "relationship_id": "edge.800004",
              "evidence_classification": "synthesized_mapping"
            }
          ]
        }
      ]
    },
    {
      "record_id": "gate.operational_rollback",
      "rule_id": "R-EVIDENCE-001",
      "predicate_matches": [
        {
          "fact_id": "reads_untrusted_external_content",
          "state": "true"
        },
        {
          "fact_id": "has_read_access",
          "state": "true"
        },
        {
          "fact_id": "has_bounded_write_tool",
          "state": "true"
        },
        {
          "fact_id": "can_cause_side_effects",
          "state": "true"
        },
        {
          "fact_id": "high_impact_action_possible",
          "state": "true"
        },
        {
          "fact_id": "approval_required_for_high_impact",
          "state": "true"
        },
        {
          "fact_id": "approver_available",
          "state": "false"
        },
        {
          "fact_id": "vector_database_requested",
          "state": "false"
        },
        {
          "fact_id": "multi_agent_autonomy_requested",
          "state": "false"
        },
        {
          "fact_id": "production_deployment_requested",
          "state": "false"
        },
        {
          "fact_id": "release_plan_required",
          "state": "false"
        }
      ],
      "scope_conditions": {
        "software_type_id": "software_type.ai_agents",
        "applicable_software_types": [
          "software_type.web_applications",
          "software_type.saas",
          "software_type.apis",
          "software_type.ai_agents",
          "software_type.security_products"
        ]
      },
      "evidence_paths": [
        {
          "software_type_id": "software_type.ai_agents",
          "applicability_relationship_id": "edge.0017",
          "record_id": "gate.operational_rollback",
          "sources": [
            {
              "source_id": "source.scrum.guide.2020",
              "claim_locator": "Product Backlog; Sprint Planning; Increment; Definition of Done; Sprint Review",
              "source_type": "Framework guide",
              "source_claims_supported": "Backlog is ordered/emergent; increments must be usable and meet Definition of Done; planning forecast depends on past performance, capacity and DoD.",
              "source_limitations": "Does not prescribe universal dependency graph, estimation formula, or story acceptance syntax.",
              "relationship_id": "edge.0349",
              "evidence_classification": "documented_guidance"
            },
            {
              "source_id": "source.google.sre.release",
              "claim_locator": "Testing; Packaging; Rapid; Deployment",
              "source_type": "Operational engineering guidance",
              "source_claims_supported": "Describes rerunning tests on the release branch, audit trail, independent system tests of packaged artifacts, and coordinating canaries and rollback.",
              "source_limitations": "Google SRE practice, not a universal policy.",